id,title,firstSentence,fullBody
29735,Worked in Theater and Radio,"Julie Berns, who wrote comedies for the Yiddish- and English-speaking theaters and for radio, died at her home in Mahopac, N.Y., on Wednesday.","Julie Berns, who wrote comedies for the Yiddish- and English-speaking theaters and for radio, died at her home in Mahopac, N.Y., on Wednesday. She was 84 years old. Among Mrs. Berns's English-language plays was ''For Heaven's Sake, Mother!'' which she produced with Jack Benny and George Burns in 1948 and which starred Molly Picon. Another was ''Uncle Willie'' (1956), written with Irving Elman, which starred Menasha Skulnick. Both plays ran on Broadway. Her Yiddish-language plays, performed primarily in the 1920's and 30's, included ''The Golden Land'' and ''Schmendrick.'' Mrs. Berns's radio serials included ''The Bronx Marriage Bureau,'' starring Molly Goldberg, and ''Life With Father,'' on which she collaborated with Hy Brown. She wrote and sometimes performed in a satirical weekly series called ''Hysterical History,'' with such guests as Eddie Cantor and George Jessel, and, with Red Barber, interviewed famous people in a series in the 30's. Mrs. Berns, whose maiden name was Elstein, was born in Spring Valley, N.Y. Survivors include two sons, Robert and Richard; a sister, Pauline Fromberg; five grandchildren, and one great-grandchild."
4687,"Geraldine Doyle, 86, Iconic Face of World War II","Geraldine Hoff Doyle, who was believed to be the unwitting model for the ''We Can Do It!''","Geraldine Hoff Doyle, who was believed to be the unwitting model for the ''We Can Do It!'' poster of a woman flexing her biceps in a factory during World War II -- an image that later became a symbol for the American feminist movement -- died on Sunday in Lansing, Mich. She was 86. The cause was complications of arthritis, said her daughter Stephanie Gregg. Mrs. Doyle was unaware of the poster's existence until 1982, when, while thumbing through a magazine, she saw a photograph of it and recognized herself. Her daughter said that the face on the poster was her mother's, but that the muscles were not. ''She didn't have big, muscular arms,'' Mrs. Gregg said. ''She was 5-foot-10 and very slender. She was a glamour girl. The arched eyebrows, the beautiful lips, the shape of the face -- that's her.'' In 1942, when she was 17, Geraldine Hoff took a job as a metal presser at a factory near her home in Inkster, Mich., near Detroit, to aid the war effort, Mrs. Gregg said. One day, a United Press photographer came in to shoot images of working women. The resulting poster, designed by the graphic artist J.Howard Miller, was used in a Westinghouse Company campaign to deter strikes and absenteeism. It was not widely seen until the early 1980s, when it was embraced by feminists. She quit the factory job after about two weeks because she learned that another woman had damaged her hands while using the metal presser, and she feared that such an injury would prevent her from playing the cello, her daughter said. At one of her next jobs, at a soda fountain, she met her husband, Leo H. Doyle, a dental student. They had been married for 66 years when he died this year. In addition to Mrs. Gregg, she is survived by four other children, 18 grandchildren and 25 great-grandchildren."
55411,"Kim Gallagher, 38, Olympic Track Medalist","Kim Gallagher, a slim but strong runner who overcame endless illnesses to win a silver medal in the 1984 Los Angeles Olympics and a bronze in the 1988 Seoul Olympics, died Monday in a Philadelphia hospital.","Kim Gallagher, a slim but strong runner who overcame endless illnesses to win a silver medal in the 1984 Los Angeles Olympics and a bronze in the 1988 Seoul Olympics, died Monday in a Philadelphia hospital. She was 38 and lived in Oreland, Pa. The cause of death was a stroke, her husband, John Corcoran, said. She learned she had colon cancer after the 1988 Olympics and stomach cancer in 1995. In remission from colon cancer, she resumed running and last competed in the 1992 United States Olympic trials. Both Olympic medals came at 800 meters, and Gallagher was the only American woman or man to win an individual track medal in Seoul at a distance longer than 400 meters. Her 1988 Olympic time of 1 minute 56.91 seconds still ranks as the third fastest by an American woman at 800 meters, behind Jearl Miles-Clark (1:56.40) and Mary Decker Slaney (1:56.90). Her athletic success was remarkable considering her health. Six months before the 1984 Olympics, she had surgery for multiple cysts on her ovaries caused by an estrogen imbalance. The condition reappeared until it was finally relieved by hormone treatment. Years later, when colon cancer was diagnosed, Gallagher rejected her doctor's recommendation of surgery and chemotherapy, treating it with vitamins, diet and rest. The cancer went into remission, then reappeared in 1994. A year later, she said: ""I'm fine, I'm healthy, I'm strong. But I really can't work a full day. I get tired."" In 1996, she used a wheelchair, but she refused to see doctors and improved enough to walk with a cane. Kimberly Ann Gallagher was born June 11, 1964, in Fort Washington, Pa., near Philadelphia. Her track career started at age 7 when she followed her 9-year-old brother, Bart, to his track club. ""He told me I couldn't join the club and not to hang around him,"" she once said. ""I remember I was wearing clogs, and I knew that I was ready to do track, whatever that was. ""When I won my first trophy and it was as big as me, I knew I wanted to someday make the Olympic team."" At 8, she ran a 5:37 mile, the fastest by a girl that age. At 16, she finished eighth in the 800 meters in the Olympic trials. Gallagher attended the University of Arizona for a semester and a half, training with the men's cross-country team. She left college, she said, because ""world-class training and competing for a college don't go hand in hand."" Until college, she had been coached by her brother, Bart, who died in 2000. When she left college, he looked for an experienced coach for her and chose Chuck DeBus in California. DeBus coached her from 1983 to 1988, but he said her health prevented her from completing half her workouts. ""Who knows how fast she could have run if she could have trained like a normal person?"" he told The Los Angeles Times. DeBus was later barred for two years by The Athletics Congress, then the sport's national governing body, for supplying anabolic steroids to his athletes. After Gallagher started training with DeBus, her 5-foot-5 body became muscular, although her weight seldom exceeded 108 pounds. She said she never took steroids. ""I never wanted to look like all those pumped-up, big-looking, talking-weird women,"" she said. ""I liked my looks too much."" Gallagher insisted she never loved the sport. She liked what it brought, especially a Mercedes-Benz and a Malibu home after her 1984 Olympic success. She is survived by her husband; her 13-year-old daughter, Jessica Smith; her mother, Barbara of Philadelphia; and her father, John of Benson, Ariz. She summed up her career by saying: ""I needed to run for all the wrong reasons. I needed to run to keep my shoe contract. I needed to run to pay my bills. I learned a huge lesson. When I ran in the 1984 Olympics, I was going to be a star. I was going to make so much money, and I did. ""But it doesn't last if you're not devoted to what you're doing. I was not devoted to my running, and it showed. I don't get a great joy from running or training or going out and doing all the work. Running is not something I love, but I like excelling at things that I am good at."""
29585,"William Dinkins, Mayor's Father And Real Estate Agent, Dies at 85","William Harvey Dinkins Jr., the father of New York's Mayor, David N. Dinkins, and a retired real estate broker in Trenton, died last night at the Delaware Valley Medical Center in Langhorne, Pa.","William Harvey Dinkins Jr., the father of New York's Mayor, David N. Dinkins, and a retired real estate broker in Trenton, died last night at the Delaware Valley Medical Center in Langhorne, Pa. He was 85 years old and was a longtime resident of Trenton. Mr. Dinkins died of cardio-pulmonary arrest, said Leland T. Jones, the Mayor's press secretary. The Mayor, who went to the hospital last night, canceled his appearances that were scheduled for today. William Dinkins moved north from Newport News, Va., in 1925, looking for work and settling in New Jersey with his first wife, Sally. They had two children, David and Joyce. The elder Mr. Dinkins's first job was in a cable factory in Trenton. Soon he became a local barber, and his shop was a popular gathering place in a neighborhood of three-story attached houses. Raised Family in Trenton He also became known in the community through his activities in fraternal, civic and church organizations. He was a 33d Degree Mason, a member of the executive board of the Trenton chapter of the National Association for the Advancement of Colored People, a member of the ethics committee of the Mercer County Board of Realtors and a member and trustee of the Shiloh Baptist Church in Trenton. Eventually he started a second career as a real estate and insurance broker that lasted more than two decades. He retired two years ago as the owner and managing broker of Dinkins Real Estate in Trenton. When David Dinkins was 6 years old, his father and mother separated. His father remained in Trenton, and initially the children moved to Harlem with their mother. But they attended school in Trenton and grew up mostly at the home of their father and stepmother, Lottie Hartgell, a schoolteacher. Young David had hoped his parents would reunite. When Mr. Dinkins remarried, the son recalled years later, ""I thought I would die."" The Mayor alluded to his childhood during the recent racial unrest in Crown Heights when he speculated that many youths were from one-parent families and added ""as was the case with me, frankly."" When his son was elected Mayor of New York City in 1989, the elder Mr. Dinkins praised his calm, quiet temperament. ""He never was a loud type of person,"" said his father, then 83 and living on Spring Street in North Trenton. ""He thought way ahead before he spoke."" The father said David was a well-behaved youngster. ""I never had to spank him or anything like that,"" he said. Not the Political Sort Mr. Dinkins was quoted by The Trenton Times in 1989 as wishing for his son's success running for mayor. But he added, ""I wouldn't want that job for a billion dollars. It's New York, and I don't like politics."" Neither did he want David following in his father's footsteps. ""I certainly didn't want him to be a barber,"" the elder Mr. Dinkins said, ""not when I was only getting 25 cents a haircut, that's for sure."" At the celebration of his son's victory, Mr. Dinkins beamed. ""I'm so proud I don't know what to say,"" he said. Mr. Dinkins's first and second wives are deceased. Besides his two children, the Mayor and Joyce Belton, of Trenton, he is survived by six grandchildren and five great-grandchildren. Funeral arrangements were pending."
54695,"SAM A. JAFFE, 55; REPORTER DID WORK FOR ABC AND CBS","Sam A. Jaffe, a former television correspondent who covered the United Nations for CBS News and reported from Moscow, Hong Kong and Vietnam for ABC News, died of lung cancer yesterday at his home in Bethesda, Md.","Sam A. Jaffe, a former television correspondent who covered the United Nations for CBS News and reported from Moscow, Hong Kong and Vietnam for ABC News, died of lung cancer yesterday at his home in Bethesda, Md. He was 55 years old. In 1976, Mr. Jaffe told a United States Senate committee that he had reported regularly to the Federal Bureau of Investigation on activities of the Soviet delegation to the United Nations in the late 1950's and early 1960's, when he worked for CBS. At the time there were many charges that intelligence agencies had infiltrated news organizations. Mr. Jaffe denied ever taking money from the F.B.I. and said he never worked for the Central Intelligence Agency or any foreign agency. He said he had been unable to find a job in journalism after leaving ABC in 1969 because of a false charge by a Soviet defector that he had once been a Soviet agent. He spent years trying to clear his name by obtaining classified files under his name. A Federal judge in 1983 ruled that all derogatory references to him in the files either came from discredited sources or consisted of gossip or inuendo. His uncle, the actor Sam Jaffe, was unable to find work for years in the 1950's because he was accused by Senator Joseph R. McCarthy, Republican of Wisconsin, of associating with Communists. Sam Adason Jaffe was born and grew up in San Francisco, graduated from the University of California at Berkeley and attended Columbia University. He was a reporter for the International New Service in the late 1940's, was a marine in Korea in 1950 and 1951 and was a Life magazine reporter until he joined CBS at the United Nations in 1955. Switching to ABC in 1961, he was a correspondent in Moscow until 1965 and in Hong Kong and Vietnam until 1969. He is survived by his wife, the former Elizabeth Jeune Georgeson; a son, David, of New York City; and three daughters, Linda Franklin, of Katonah, N.Y., and Deborah and Leah, of Bethesda."
22355,Marisa Bellisario Dies in Turin; Industrialist Was in Her Early 50's,"Marisa Bellisario, president of Italy's Italtel telecommunications company and former head of Olivetti Corporation of America, died of cancer today at her home in Turin.","ROME, Aug. 4 Marisa Bellisario, president of Italy's Italtel telecommunications company and former head of Olivetti Corporation of America, died of cancer today at her home in Turin. She was in her early 50's. Miss Bellisario was appointed managing director and chief executive officer of the state-owned Italtel group in 1981. Italtel, formally Italtel Societa Italiana Telecomunicazione, is the 34th largest company in Italy, according to reports, and one of several telecommunications operations in that nation. When she took over, losses were more than $215 million a year. She cut the losses in half in 1982 and then returned it to profitability, where it has remained under her direction. She wrote her own life story in the book ''Woman and Top Manager,'' frequently worked 12-hour days, but refused to work weekends in order to spend the time with her husband, Lionello Cantoni, a mathematics professor. ''Maybe I can show young girls that you can make it and still be a normal woman, with normal attitudes toward your family or husband,'' she said. Before joining Italtel, Miss Bellisario was president and chief executive of Olivetti of America. She joined the company in 1972 and became director of corporate planning and then director of the Distributed Data Processing group. She became the head of product and operations planning at General Electric Information Systems Italia in 1965 and kept that post when the electronics division was acquired by Honeywell Information Systems Italia in 1969. Miss Bellisario, an economics graduate of Turin University, began her business career in Olivetti's computer division in 1960."
17039,"Theodore Berry, 94, Civil Rights Pioneer, Dies","Theodore M. Berry, a civil rights leader who became Cincinnati's first black mayor after serving as a high official in President Lyndon B. Johnson's war on poverty, died Sunday at a nursing home in Loveland, a Cincinnati suburb.","Theodore M. Berry, a civil rights leader who became Cincinnati's first black mayor after serving as a high official in President Lyndon B. Johnson's war on poverty, died Sunday at a nursing home in Loveland, a Cincinnati suburb. He was 94. Mr. Berry fought for racial equality as a civil rights lawyer, representing three Tuskegee Airmen in a famous case; as a leader of the National Association for the Advancement of Colored People; and as the official assigned to bring poor people into the policy-making process of the federal anti-poverty effort under Sargent Shriver. He was Cincinnati's first black assistant prosecutor and first black vice mayor before becoming mayor in 1972. Theodore M. Berry was born on Nov. 8, 1905, in Maysville, Ky. The Cincinnati Post quoted Mr. Berry in 1973 as saying that his mother, a deaf-mute housekeeper, was ""taken advantage of by a former employer,"" a white farmer in Maysville. The matter was dropped when the farmer gave his grandmother, a former slave, two hogs. As a child in Cincinnati, Mr. Berry sold newspapers, shined shoes, shoveled coal, delivered laundry and shelved books in libraries. He learned to speak with unusually distinct diction so his mother could read his lips. He graduated at the top of his high school class, but, although he was the school's first black valedictorian, he was forbidden to walk next to a white classmate at the graduation, The Cincinnati Enquirer reported in an obituary published yesterday. He graduated from the University of Cincinnati and then from its law school, working in steel mills to pay his way. His first legal job was as a county prosecutor. He served as president of the Cincinnati branch of the N.A.A.C.P. from 1932 to 1946. In 1942, he took a leave of absence from the prosecutor's office to go to Washington to work as a morale officer with the Office of War Information. His job was to encourage black soldiers, who were then segregated, a situation he saw the government did not intend to end. ""They wanted to play games with"
53925,"Eloy Gutirrez-Menoyo, Cuban Dissident, Dies at 77","Eloy Gutirrez-Menoyo, who went from fighting beside Fidel Castro as a rebel commander to spending 22 years in prison for trying to topple him, died on Friday in Havana, where he had lived his last years as a tolerated dissident.","Eloy Gutirrez-Menoyo, who went from fighting beside Fidel Castro as a rebel commander to spending 22 years in prison for trying to topple him, died on Friday in Havana, where he had lived his last years as a tolerated dissident. He was 77. The cause was a heart attack, his wife, Flor Ester Torres Sanabria, told The Associated Press. On Dec. 8, 1934, Mr. Gutirrez-Menoyo was born into a Spanish family dedicated to fighting for freedom: his oldest brother died fighting fascists in Spain's civil war. The family moved from Madrid to Cuba in 1945. In 1957, another brother died in a failed attack against the Cuban strongman Fulgencio Batista. Eloy soon joined the fight against Batista, assembling an army in Cuba's mountains almost as large as Mr. Castro's own force. After Batista fled on Jan. 1, 1959, Mr. Gutirrez-Menoyo and his troops arrived in Havana on Jan. 3, days before Mr. Castro led his own army into the city. Mr. Gutirrez-Menoyo was not offered a post in the Castro government, and later said he had not wanted one. He retained the rank of major, the highest in Cuba at the time. His army was absorbed into Mr. Castro's. But disturbed with Mr. Castro's turn toward leftist dictatorship, Mr. Gutirrez-Menoyo and a dozen military and civilian supporters fled by boat to the United States in January 1961. He settled in Miami and formed an organization to overthrow Mr. Castro, naming it Alpha 66. It was not involved in the failed Bay of Pigs invasion in April 1961, and it grew to become one of the largest anti-Castro exile groups. In October 1964, Mr. Gutirrez-Menoyo led a cadre of men into the Cuban mountains to establish a secure base from which to expand to fight the Communist state, just as Mr. Castro had done to fight the Batista government. He told interviewers that the mission was financed by other exiles, not by the Central Intelligence Agency. Mr. Gutirrez-Menoyo and his men were captured by government troops. Blindfolded, he was taken on a 90-minute plane ride, and when the blindfold was removed he found himself facing Mr. Castro, who was sitting behind a desk surrounded by his top aides. ''You realize, of course, that we are going to shoot you,'' he quoted Mr. Castro as saying in a 1987 account in The New York Times Magazine. Mr. Gutirrez-Menoyo told Mr. Castro of his family's revolutionary past and said he would accept death. Mr. Castro said he would also kill his men but would spare them if Mr. Gutirrez-Menoyo would go on television and affirm that no Cubans wanted to overthrow their government. He accepted the deal and later, after a 30-minute trial, was sentenced to 30 years in prison. As an inmate, Mr. Gutirrez-Menoyo refused to work or wear a prison uniform, saying the requirements violated international law covering the treatment of political prisoners. For his refusal he was beaten so badly that he became blind in one eye and deaf in one ear. He spent time in six prisons over 22 years before being released in 1986, largely through the efforts of Prime Minister Felipe Gonzlez of Spain. Mr. Gutirrez-Menoyo returned to Miami in 1993 and set up an organization to encourage peaceful dialogue between the Cuban government and antigovernment exiles. He called it Cambio Cubano (Cuban Change). He said he was determined not to be embittered. ''When you spend entire years in solitary, you learn that human beings have a lot of inner resources,'' he told The Times in an interview in 1993. ''When you are subjected to a policy of savagery and barbarism, you come to the conclusion that you have to reject those methods, that you have to be the first to set hatred aside, otherwise it will destroy you.'' In 1995, Mr. Castro agreed to Mr. Gutirrez-Menoyo's repeated requests for a meeting. They had a three-hour exchange in Havana, during which Mr. Gutirrez-Menoyo pressed Mr. Castro to allow Cambio Cubano to function as an opposition party in Cuba. That never happened, but Mr. Gutirrez-Menoyo was allowed to return to Cuba repeatedly and, in 2003, to settle there. He did not succeed in opening an office for his organization, but he did meet with Cuban moderates. ''Cuba cannot continue to corner itself, trying to convince the world that there is democracy, when a one-party system will never be a democracy,'' he said. In addition to his wife, Mr. Gutirrez-Menoyo is survived by three sons and a daughter, The A.P. said. When they met in 1995, he and Mr. Castro had not seen each other since Mr. Castro had threatened to shoot him three decades earlier. Mr. Castro's first"
37801,"Benton Owen, 88, Ex-Chemistry Professor","Benton B. Owen, professor emeritus of chemistry at Yale University and a leader in his field, died of cancer Sunday at Kaiser Permanente Hospital in El Cajon, Calif.","Benton B. Owen, professor emeritus of chemistry at Yale University and a leader in his field, died of cancer Sunday at Kaiser Permanente Hospital in El Cajon, Calif. He was 88 years old and lived in Solana Beach, Calif. Professor Owen, a native of Richmond, was a member of the Yale faculty from 1930 to 1965. He specialized in thermodynamics, electrochemistry and piezochemistry, which is the study of the effects of high pressure on chemical reactions. Professor Owen graduated from the University of Virginia in 1922. After graduate work at the Sorbonne, he enrolled in Yale in 1925. After retiring from Yale, he became a research chemist and lecturer at the University of California at San Diego Scripps Institution of Oceanography until 1969, when he became a research associate at Scripps, a post he held until 1977. He is survived by his wife, the former Nancy Mae Kelly; two daughters, Virginia Torrance of Boulder, Colo., and Sarah Ford of Nyack, N.Y.; a brother, Dr. Joseph, of the Bronx; three grandchildren, and one great-grandson."
24565,"Helen H. Miller, 96, Biographer, Is Dead","Helen Hill Miller, a prolific biographer and journalist, died on Tuesday at George Washington University Medical Center in Washington.","Helen Hill Miller, a prolific biographer and journalist, died on Tuesday at George Washington University Medical Center in Washington. She was 96, and had homes in Washington and Kitty Hawk, N.C. Mrs. Miller wrote more than 20 books. Her biographies included ""George Mason: Constitutionalist"" (1938), ""Captains From Devon: The Great Elizabethan Seafarers Who Won the World for England"" and ""Colonel Parke of Virginia: The Greatest Hector in Town"" (1990). She also wrote six books on Greece and several works on foreign policy. Mrs. Miller was born in Highland Park, Ill. She received a bachelor's degree from Bryn Mawr College in 1921, a diploma in economics from Oxford University in 1922 and a doctorate in political science from the University of Chicago in 1928. After working as a staff writer for the Agriculture Department in the late 1930's, she became a Washington correspondent for The Economist and Newsweek from 1940 to 1952. From 1958 to 1966, she was a contributing editor of The New Republic. She also contributed to Harper's Magazine and Esquire. At the time of her death she had just completed a memoir, ""Washington Observed."" She is survived by two sons, Andrew, of Washington, and Robert, of Elizabethtown, N.C., and nine grandchildren."
15261,Barney McNulty Dies at 77; First to Use TV Cue Cards,"Barney McNulty, who is generally credited with being the first person to use cue cards on television, died on Dec. 18 at his home in Studio City, Calif.","Barney McNulty, who is generally credited with being the first person to use cue cards on television, died on Dec. 18 at his home in Studio City, Calif. He was 77. He apparently died of a heart attack, his wife, Jill, said. Mr. McNulty first exhibited his knack for turning someone else's phrase in 1949 while working as an usher at the CBS Studios in Hollywood. The comedian Ed Wynn, who routinely used cue cards with a few"
