id,title,firstSentence,fullBody
54890,"David Lamb, Author and War Correspondent in Vietnam, Dies at 76","David Lamb, a dauntless foreign correspondent for The Los Angeles Times who also wrote critically acclaimed books about the Arab world and Africa, died on Sunday in Alexandria, Va.","David Lamb, a dauntless foreign correspondent for The Los Angeles Times who also wrote critically acclaimed books about the Arab world and Africa, died on Sunday in Alexandria, Va. He was 76. Sandy Northrop, his wife and only immediate survivor, said the cause was lymphoma and esophageal cancer. Mr. Lamb covered the front lines in Vietnam for United Press International and the fall of Saigon for The Times in 1975. Xan Smiley, a top editor at The Economist, characterized him as ''inexhaustibly gutsy.'' Mr. Lamb was credited with naming the site of a 10-day battle in the A Shau Valley in 1969 ''Hamburger Hill.'' A young G.I. had told him, ''With all this chopped-up red meat, it reminds me of a hamburger,'' and the name stuck. He returned to Vietnam in 1997 to open the newspaper's bureau in Hanoi, becoming the only American wartime newspaper correspondent to live there in peacetime. Mr. Lamb often embellished his books and articles with personal experience. Discovering once that his taxi driver had fought for the North Vietnamese, Mr. Lamb asked whether the cabby hated him because he was an American. ''We fought the Chinese for 1,000 years; we fought the French for 100,'' the cabby replied. ''You were here just for 10. You were just a blip in the history of a proud nation.'' He cobbled together observations like those into a 2002 book, ''Vietnam, Now: A Reporter Returns,'' and a PBS documentary, ''Vietnam Passage: Journeys From War to Peace,'' the same year. Mr. Lamb also wrote two domestic travelogues. For one, ''Stolen Season: A Journey Through America and Baseball's Minor Leagues'' (1991), he attended minor league games all over the country. For the other, ''Over the Hills: A Midlife Escape Across America by Bicycle'' (1996), he bicycled 3,145 miles from his home in Washington to Santa Monica, Calif., armed, he said, with two bottles of Scotch, a carton of cigarettes and an ample supply of ibuprofen. In ''The Arabs'' (1987), a portrait of a region and a people he came to know as a reporter, Mr. Lamb produced a compelling primer peppered with illuminating anecdotes. One passage revealed that King Fahd of Saudi Arabia had recruited the designer of a floating space city in ''Star Trek'' to refurbish his Boeing 747 with gold-plated hardware and a three-story elevator. ''Mr. Lamb has the first-rate reporter's essential tools -- his eyes and his ears,'' James F. Clarity, a correspondent for The New York Times, wrote about ''The Arabs'' in The Times Book Review, ''and he uses them to relate, sometimes with compelling detail, who the Arabs are, why they act the way they do and why the rest of the world, particularly the United States, has a stake in what they do that goes beyond oil prices.'' Mr. Lamb wrote his first book, ''The Africans'' (1983), after logging 300,000 miles through 48 countries during four years of covering the continent. He quoted James Richard Mancham, the first president of the Seychelles, as saying: ''Look at it this way, I'm alive. That's more than a lot of ex-presidents in Africa can say. Besides that, everyone had fun when I was president, and how many ex-presidents can say that?'' David Sherman Lamb was born on March 5, 1940, in Boston, the son of Ernest Lamb, a private investment manager, and the former Pauline Ayers. He began his career at 14, after writing to The Milwaukee Journal and volunteering to contribute a weekly column about his beloved Braves from the perspective of a teenager who had seen the team desert Boston for Milwaukee. The Journal's sports editor agreed, and David's father rented him a typewriter for $9 a month. He graduated from the School of Journalism at the University of Maine in 1962 and began his career on The Okinawa Morning Star. He worked in Las Vegas and Oakland, Calif.; reported for U.P.I. in San Francisco, Denver and Saigon; and was assigned to New York and Washington by The Los Angeles Times. He served as bureau chief in Cairo, Nairobi, Sydney and Hanoi before he left the paper in 2004 after 34 years. A world map in his office was stuck with 185 pins, one for each country he visited as a correspondent. During an unpaid leave from The Times, Mr. Lamb bought a used mobile home and spent a summer wandering the country for what became ''Stolen Season.'' ''This baseball journey was born in the rubble of Beirut while some maniacs were blowing away my hotel with tanks, chunk by chunk,'' he wrote. He said he told a colleague that if he survived, ''I'm going to find something to write about that's a million miles from Beirut. Like baseball.''"
46725,"Jimi Jamison, Singer for Survivor, Dies at 63","Jimi Jamison, the lead singer of the band Survivor for many years, died on Sunday at his home in Nashville.","Jimi Jamison, the lead singer of the band Survivor for many years, died on Sunday at his home in Nashville. He was 63. His booking agent, Sally Irwin, said the cause was apparently a heart attack. Mr. Jamison joined Survivor in 1984, replacing Dave Bickler, two years after the group's biggest hit and only No. 1 single, ''Eye of the Tiger,'' the theme song to the Sylvester Stallone film ''Rocky III.'' With Mr. Jamison as lead vocalist, the band went on to have several more Top 10 hits, including ''Burning Heart'' (heard in ''Rocky IV'') and ''Is This Love,'' and remained a popular touring act. Mr. Jamison left and rejoined the band twice. He also sang and was a co-writer for ''I'm Always Here,'' the theme to the hit television series ''Baywatch.'' Born in Mississippi in 1951, Mr. Jamison sang with the bands Target and Cobra before joining Survivor."
51344,73,"Lanford Wilson, the Pulitzer Prize-winning playwright whose work -- earthy, realist, greatly admired, widely performed -- centered on the sheer ordinariness of marginality, died on Thursday in Wayne, N.J.","Lanford Wilson, the Pulitzer Prize-winning playwright whose work -- earthy, realist, greatly admired, widely performed -- centered on the sheer ordinariness of marginality, died on Thursday in Wayne, N.J. He was 73 and lived in Sag Harbor, on Long Island. The cause was complications of pneumonia, said Marshall W. Mason, a director and longtime collaborator who is widely considered the foremost interpreter of Mr. Wilson's work. One of the most distinguished American playwrights of the late 20th century, Mr. Wilson was considered instrumental in drawing attention to Off Off Broadway, where his first works were staged in the mid-1960s. He was also among the first playwrights to move from that milieu to renown on wider stages, ascending to Off Broadway, and then to Broadway with no Off's whatsoever, within a decade of his arrival in New York. His work has also long been a staple of regional theaters throughout the United States. Mr. Wilson won the 1980 Pulitzer Prize for drama for ''Talley's Folly,'' which played 286 performances on Broadway that year. A one-act, two-character comedy set in his hometown, Lebanon, Mo., the play chronicled the romantic fortunes of a Jewish man (played by Judd Hirsch) and a Protestant woman (Trish Hawkins) in 1944. ''Talley's Folly'' was an installment in Mr. Wilson's Talley Cycle, an eventual trilogy. The cycle also comprised ''Talley & Son,'' which played Off Broadway in 1985 and also looked in on the Talley family in 1944; and ''Fifth of July,'' which takes up the family's story in 1977. ''Fifth of July,'' a comedy that explores the disillusionment of the Vietnam era, came to Broadway in November of 1980. The production, which starred Christopher Reeve as Kenneth Talley Jr., a gay, paraplegic Vietnam veteran, ran for 511 performances at the New Apollo Theater; it also starred Jeff Daniels and Swoosie Kurtz. Reviewing the production in The New York Times, Frank Rich wrote: ''Mr. Wilson has poured the full bounty of his gifts into this work, and they are the gifts of a major playwright. 'Fifth of July' is a densely packed yet buoyant outpouring of empathy, poetry and humor, all shaped into a remarkable vision.'' Mr. Wilson's other Broadway plays include ''Burn This'' (1987), ''Angels Fall'' (1983) and ''Redwood Curtain'' (1993). His Off Broadway work included ''The Hot l Baltimore,'' about the denizens of a down-at-the-heels residential hotel. The play was the basis of a short-lived television sitcom of the same name, broadcast on ABC in 1975. With Mr. Mason, Tanya Berezin and Rob Thirkield, Mr. Wilson founded the Circle Repertory Company, a highly regarded collective of actors, directors, playwrights and others known for its collaborative approach. Established in 1969 on the Upper West Side as the Circle Theater Company, it later moved to the Sheridan Square Playhouse in Greenwich Village. The company ceased operations in 1996. Besides producing work by Mr. Wilson, Circle Rep produced plays by Jules Feiffer, Sam Shepard, Larry Kramer and others. Actors associated with the company include William Hurt, Kathy Bates, Barnard Hughes, Cherry Jones and Cynthia Nixon. Stylistically, the distinguishing hallmark of Mr. Wilson's work was his dialogue -- authentic, gritty, often overlapping -- be it the speech of his native Missouri or adopted New York. To audiences, his approach gave the experience of eavesdropping on real, bustling people in real, bustling time. (As a young playwright honing his craft, he later explained, he would set himself exercises like writing down the overheard speech of five people talking at once.) Thematically, his work concerned dissolutions large and small: the rupture of societies, families and individual marriages; the loss of life, love, companionship and sanity. His characters, drawn true to life if sometimes larger, tended toward the socially marginalized, perhaps no surprise for a man whose identity -- Ozark, somewhat rootless, a child of a broken home, gay at a time when it was taboo to be gay -- no doubt made him feel pushed to the margins of mainstream culture himself. (Mr. Wilson was noted for being one of the first mainstream playwrights to create central, meaningful gay and lesbian characters.) Ragtag collections of prostitutes and pimps, drug addicts and sundry urban nighthawks, the people who populate his plays were unusual theatrical subjects in their day, but were no less sympathetic for that. In many respects, as he made clear in interviews, Mr. Wilson saw his work as the counterpart to the New Realism of post-1960 visual art, in which artists created works that were amalgams of images, often fragmentary, observed in the world around them and ripe for the taking. As he also made clear, the subject matter of many of his plays was drawn from his own life. Lanford Eugene Wilson was born in Lebanon on April 13, 1937; his parents divorced when he was a young child. He moved with his mother to Springfield, Mo., and, after she remarried a farmer, to Ozark, Mo. After studying briefly at Southwest Missouri State College, Mr. Wilson moved to San Diego, where his father was living. Their reunion -- not a happy one, though their relationship fared better in later years -- became the basis of ''Lemon Sky.'' That play, first performed in 1970 at the Studio Arena Theater in Buffalo, opened Off Broadway that year at the Playhouse Theater on West 48th Street, and was revived in 1985 at the Second Stage Theater. It was later adapted as a television movie, first broadcast in 1988 and starring Kevin Bacon as the youth who attempts to bond with his estranged father. In San Diego, the young Mr. Wilson worked at a desultory job in an aircraft plant and took classes at what was then San Diego State College. It was there, in a writing class, that he discovered dialogue and determined to become a writer of short stories. In the late 1950s, Mr. Wilson moved to Chicago, where he worked as a commercial artist in an advertising agency and took extension classes at the University of Chicago. He wrote a sheaf of short stories that were rejected by all the magazines to which he sent them, and made his first tentative stabs at writing plays. Mr. Wilson settled in New York in 1962. There, as the reference work Current Biography wrote in 1979, he ''saw and disliked every play on Broadway.'' He found the ersatz environment of Off Off Broadway, with its theater spaces shoehorned into coffeehouses and church basements, far more congenial. His first produced play, a one-act called ''So Long at the Fair,'' was staged at Caffe Cino, in the Village, in 1963. It concerned a young man, newly arrived in New York, and the young woman who hopes to seduce him. Reviewing the play, The Village Voice praised the ''exactness and inner logic'' of the dialogue. Over the years to come, Mr. Wilson's facility for dialogue proved both a great strength and an occasional weakness: critics sometimes took him to task for neglecting other aspects of dramatic construction, like tight plotting, in favor of the rush of pure spoken language. In 1965, Mr. Wilson attracted attention with ''The Madness of Lady Bright,'' also at Caffe Cino. Its protagonist, Leslie Bright, is a middle-aged gay man confronting a wistful past, a lonely present and an uncertain future. He garnered still wider attention for his first full-length play, ''Balm in Gilead,'' also staged in 1965, at La MaMa. The play, about low-life characters converging in the New York nightscape, was so successful that Ellen Stewart, La MaMa's founder, had to stand on the sidewalk each night and beseech an eager fire marshal not to close the theater, packed to capacity. His first play to come to Broadway was ''The Gingham Dog,'' about the dissolution of an interracial marriage. It ran for just 19 performances in 1969. Mr. Wilson was single at the time of his death. Survivors include two half-brothers, John and Jim, and a stepsister, Judy. In an interview quoted in The Times in 2002, Mr. Wilson expounded on his realist, quasidocumentary approach: ''I want people to see -- and to read -- my plays and to say: 'This is what it was like living in that place at that time. People haven't changed a damn bit. We can recognize everyone.' ''"
9637,"George M. Szabad -- Lawyer and Businessman, 85","George M. Szabad, a lawyer, businessman and former member of the board of governors of the American Jewish Committee, died on March 30 at his home in Haverford, Pa.","George M. Szabad, a lawyer, businessman and former member of the board of governors of the American Jewish Committee, died on March 30 at his home in Haverford, Pa. He was 85. Mr. Szabad, a longtime resident of Scarsdale, N.Y., was also a former president of the committee's Westchester County chapter. He received the group's national distinguished leadership award in 1999. George Michael Szabad was born in Russia and brought up in Warsaw. He came to the United States in 1934, attended college and graduated from Columbia Law School. In 1952, he became president of the TelAutograph Corporation, a communications equipment manufacturer. In 1954, he joined the Burndy Corporation, a maker of electrical connectors, where he was a senior vice president and director. Mr. Szabad's first wife, the former Shirley Meyers, died in 1992. He is survived by his second wife, the former Janet Fulton Omholt, and the two children from his first marriage, Peter, of Madison, Va., and Ellen Ljung of Geneva, Ill.; six grandchildren; and five great-grandchildren."
46942,"John Calamari, 73, Author of Law Texts","John D. Calamari, an expert on contract law who was co-author of a primary textbook on the subject, died on Nov. 24 in New Rochelle (N.Y.) Hospital.","John D. Calamari, an expert on contract law who was co-author of a primary textbook on the subject, died on Nov. 24 in New Rochelle (N.Y.) Hospital. He was 73 and lived in Pelham Manor. The cause of death was pneumonia, said his son, Paul, of Ossining. As a professor of law at Fordham University, Mr. Calamari wrote, with Joseph Petrillo, ""Law of Contracts"" (West Publishing Company, 1970.) The textbook, in its third printing, is one of the first books law students encounter when they begin studying the nature of agreements. He also was a co-author, with Professor Petrillo and Helen Bender, of ""Contracts Cases and Problems"" (West Publishing Company, 1978). In addition, he wrote a casebook on mortgages. Born in Brooklyn in 1921, he received an undergraduate degree from Fordham College in 1942 and law degrees from Fordham Law School in 1947 and New York University in 1950. He joined Fordham's law faculty in 1952 and retired in 1991. He is also survived by his wife of 39 years, Louise, and a daughter, Cynthia, both of Pelham Manor; a brother, Joseph A. of Garden City, L.I., and two grandchildren."
10571,"Jack Lucas, 80; Earned Medal of Honor at 17",", Miss.","JACKSON, Miss. Jack Lucas, who at 14 lied his way into the military to serve in World War II and became the youngest marine ever to receive the Medal of Honor, died Thursday in Hattiesburg, Miss., where he made his home. He was 80. Mr. Lucas had been hospitalized with leukemia and died after asking doctors to remove a dialysis machine, said his wife, Ruby. Jacklyn Lucas, known as Jack, was just six days past his 17th birthday when, in February 1945, his heroism at Iwo Jima earned him the medal. He used his body to shield three members of his squad from two grenades and was nearly killed when one exploded. ''A couple of grenades rolled into the trench,'' Mr. Lucas said in an interview with The Associated Press shortly before he received the medal from President Harry S. Truman in October 1945. ''I hollered to my pals to get out and did a Superman dive at the grenades.'' But ''I wasn't a Superman after I got hit,'' he added, recalling the scream he let out ''when that thing went off.'' Mr. Lucas was left with more than 250 pieces of shrapnel in his body and had 26 operations in the following months. He was discharged as a private first class. The youngest member of the military to receive the Medal of Honor in any conflict other than the Civil War, he became a symbol of patriotism in the ensuing decades, meeting presidents and traveling the world to speak with frontline troops and fellow veterans. Mr. Lucas, born in Plymouth, N.C., on Feb. 14, 1928, was a 13-year-old cadet captain in a military academy when the Japanese bombed Pearl Harbor. Big for his age and eager to serve, he forged his mother's signature on an enlistment waiver that would have allowed him to join the Marines at 17 rather than the usual 18. But in fact he was by then only 14, though the military did not learn of that until censors discovered it through a letter he had written to his 15-year-old girlfriend. ''They had him driving a truck in Hawaii because his age was discovered, and they threatened to send him home,'' said D. K. Drum, who wrote Mr. Lucas's story with him in the 2006 book ''Indestructible.'' Mr. Lucas eventually stowed away aboard a Navy ship headed for combat in the Pacific. He turned himself in aboard ship to avoid being listed as a deserter, and volunteered to fight. The officers aboard ''did not know his age,'' Ms. Drum said. ''He didn't give it up, and they didn't ask.'' After the war, Mr. Lucas earned a business degree from High Point University in North Carolina and raised, processed and sold beef in the Washington area. In the 1960s, he rejoined the military, becoming an Army paratrooper to conquer his fear of heights, Ms. Drum said. On a training jump, both of his parachutes failed, she said, and Mr. Lucas later said his stocky build and a last-second roll as he hit the ground had saved his life. In addition to his wife, Mr. Lucas is survived by four sons, a daughter, seven grandchildren and six great-grandchildren."
26392,"William A. Koshland, 90, Former Knopf President, Dies","William A. Koshland, chairman emeritus and former president of the publisher Alfred A. Knopf, died on Wednesday at Mount Sinai Medical Center in Manhattan.","William A. Koshland, chairman emeritus and former president of the publisher Alfred A. Knopf, died on Wednesday at Mount Sinai Medical Center in Manhattan. He was 90 and lived in Manhattan. The cause was cancer, said William T. Loverd, a senior vice president at Knopf, an autonomous division of Random House since 1960. Mr. Koshland, born in Boston and a 1928 graduate of Harvard College, began his career at Knopf in 1934. He soon established a close relationship with Alfred A. and Blanche W. Knopf, who founded the house in 1915 in Manhattan and turned its imprint into a seal of quality. Modesty was not Mr. Knopf's strong suit, which seemed fine with Mr. Koshland as he worked behind the scenes to extend and strengthen the firm's relations with authors, booksellers and publishers at home and abroad. He became a regular at the Frankfurt Book Fair well before many other American publishers marked it as a must on their calendars. He kept in touch with Knopf's foreign writers, including Thomas Mann, Brendan Behan and Elizabeth Bowen. Among the American authors he dealt with were Willa Cather, Ira Gershwin, John Hersey and Robert Nathan. Mr. Koshland achieved a major hit when he added ""Mastering the Art of French Cooking"" by Julia Child, Louisette Bertholle and Simone Beck to the fabled Knopf list in 1961. That first volume kindled a revolution in American kitchens as well as a lasting relationship with Julia Child and one of publishing's longest-running and most lucrative success stories. He was named president of Knopf in 1966 and succeeded Mr. Knopf as chairman in 1973. Mrs. Knopf died in 1966 and Mr. Knopf in 1984, having kept in touch with the editors about the editorial content and commercial fortunes of the Knopf list. Mr. Loverd, Knopf's publicity director, said that after Mr. Koshland's retirement 20 years ago he maintained contacts with foreign houses and some of the authors he had worked with, and advised on matters like royalties. ""But,"" he added, ""the greatest value of all was that he was the corporate memory of the house."" Sonny Mehta, president and editor in chief of Knopf, said yesterday that Mr. Koshland ""epitomized the postwar international publishing community: an urbane, close-knit network that dealt with serious writing, irrespective of where it originated, in a time when publishers did not travel with the frequency they do now."" William Abraham Koshland served as a naval air officer in Asia and the Pacific in World War II, winning the Distinguished Flying Cross, among other decorations. He was a benefactor of Phillips Exeter Academy, Harvard University and U.J.A.-Federation of Jewish Philanthropies. There are no immediate survivors."
6995,"Harry Starr, 71, Dies; A Trucking Executive","Harry A. Starr, an executive in New York's garment trucking industry, died on Aug. 17 at his home in Montclair, N.J.","Harry A. Starr, an executive in New York's garment trucking industry, died on Aug. 17 at his home in Montclair, N.J. He was 71 years old. Mr. Starr died of a heart attack, a spokesman for the family said. Mr. Starr founded Coro Trucking in 1947, which later became Trucking Services Inc., now based in Jersey City. He was also president of H.H.I.S. Trucking Service, also in Jersey City. He served as a representative of the trucking industry on Mayor John V. Lindsay's commission to improve the business climate in New York in the early 1970's. Mr. Starr was born in Brooklyn, attended City College and graduated from Rutgers University in Newark in 1939. After World War II, during which he served as an Army captain, he received a master's degree in business administration from New York University. He is survived by his wife, the former Carol Schustrin; five sons, Michael, Richard, David and Gregory, all of Manhattan, and Philip, of Baton Rouge, La.; two sisters, Ethel Westreich of Maplewood, N.J., and Lee Wortzel of Westfield, N.J., and two grandchildren."
30831,"Walter F. Thomas, 77, Retired Bank Executive","Walter F. Thomas, a retired vice chairman of the Manufacturers Hanover Corporation, died of cardiac arrest Nov. 7 in a nursing home in Boca Raton, Fla.","Walter F. Thomas, a retired vice chairman of the Manufacturers Hanover Corporation, died of cardiac arrest Nov. 7 in a nursing home in Boca Raton, Fla. He was 77 years old and lived in Boca Raton. Mr. Thomas, who worked in the banking industry for more than four decades, retired as vice chairman of the Manufacturers Hanover in 1974 and as a director in 1976. A native of Plainfield, N.J., he graduated from Princeton University in 1931 and began his banking career that year, joining what was then the Central Hanover Bank and Trust Company. In World War II he served in the Navy. Afterward, he rejoined the bank, where he became a vice president in 1948 and senior vice president in 1957. With the merger of the Hanover Bank and the Manufacturers Trust in 1961, he was named head of operations of the combined banks. In 1963 he became executive vice president of the Manufacturers Hanover Trust Company and in 1970 was named vice chairman and a director. He is survived by his wife, Jeanne; two sons, Roger, of West Windsor, N.J., and Walter Jr., of Mendham, N.J.; a sister, Harriet Miller of Short Hills, N.J., and five grandchildren."
